{
  "version": 1,
  "gameType": "main-street",
  "startedAt": "2026-04-17T23:17:30.418Z",
  "endedAt": "2026-04-17T23:17:30.423Z",
  "initialState": {
    "seed": "e2e-1776467849129"
  },
  "events": [
    {
      "type": "action",
      "turn": 1,
      "action": {
        "type": "buy-business",
        "detail": "biz-laundromat-0 -> slot 0"
      }
    },
    {
      "type": "action",
      "turn": 1,
      "action": {
        "type": "buy-event",
        "detail": "evt-charity-drive-27"
      }
    },
    {
      "type": "turn-end",
      "turn": 1
    },
    {
      "type": "game-end",
      "turn": 1,
      "finalScore": 14,
      "result": {
        "outcome": "loss"
      },
      "endReason": "bankruptcy"
    }
  ],
  "results": {
    "finalScore": 14,
    "result": "loss",
    "endReason": "bankruptcy"
  }
}