{
  "version": 1,
  "gameType": "main-street",
  "startedAt": "2026-04-17T23:24:22.710Z",
  "endedAt": null,
  "initialState": {
    "seed": "e2e-sample-0",
    "streetGrid": [
      null,
      null,
      null,
      null,
      null,
      null,
      null,
      null,
      null,
      null
    ],
    "market": {
      "businesses": [],
      "investments": []
    }
  },
  "events": [
    {
      "type": "ai-action",
      "turn": 1,
      "strategy": "Greedy",
      "action": {
        "type": "buy-business",
        "cardId": "cafe-1",
        "slotIndex": 2
      }
    },
    {
      "type": "hint",
      "turn": 2,
      "recommendedAction": {
        "type": "buy-business",
        "cardId": "bakery-3",
        "slotIndex": 4
      },
      "rationale": "Buy Bakery for synergy"
    },
    {
      "type": "action",
      "turn": 2,
      "action": {
        "type": "buy-business",
        "cardId": "bakery-3",
        "slotIndex": 4
      }
    },
    {
      "type": "undo",
      "turn": 2,
      "reversedAction": {
        "type": "buy-business",
        "cardId": "bakery-3",
        "slotIndex": 4
      }
    },
    {
      "type": "redo",
      "turn": 2,
      "reappliedAction": {
        "type": "buy-business",
        "cardId": "bakery-3",
        "slotIndex": 4
      }
    },
    {
      "type": "turn-end",
      "turn": 2
    },
    {
      "type": "game-end",
      "turn": 10,
      "result": {
        "outcome": "win"
      },
      "finalScore": 150
    }
  ],
  "results": null
}