{
  "version": 1,
  "gameType": "main-street",
  "startedAt": "2026-04-17T23:16:43.590Z",
  "endedAt": "2026-04-17T23:16:43.599Z",
  "initialState": {
    "seed": "e2e-1776467802034"
  },
  "events": [
    {
      "type": "action",
      "turn": 1,
      "action": {
        "type": "buy-business",
        "detail": "biz-pawnshop-1 -> slot 0"
      }
    },
    {
      "type": "turn-end",
      "turn": 1
    },
    {
      "type": "action",
      "turn": 2,
      "action": {
        "type": "skip",
        "detail": "No affordable actions"
      }
    },
    {
      "type": "turn-end",
      "turn": 2
    },
    {
      "type": "action",
      "turn": 3,
      "action": {
        "type": "skip",
        "detail": "No affordable actions"
      }
    },
    {
      "type": "turn-end",
      "turn": 3
    },
    {
      "type": "action",
      "turn": 4,
      "action": {
        "type": "skip",
        "detail": "No affordable actions"
      }
    },
    {
      "type": "turn-end",
      "turn": 4
    },
    {
      "type": "action",
      "turn": 5,
      "action": {
        "type": "buy-event",
        "detail": "evt-festival-1"
      }
    },
    {
      "type": "turn-end",
      "turn": 5
    },
    {
      "type": "action",
      "turn": 6,
      "action": {
        "type": "skip",
        "detail": "No affordable actions"
      }
    },
    {
      "type": "turn-end",
      "turn": 6
    },
    {
      "type": "action",
      "turn": 7,
      "action": {
        "type": "skip",
        "detail": "No affordable actions"
      }
    },
    {
      "type": "turn-end",
      "turn": 7
    },
    {
      "type": "action",
      "turn": 8,
      "action": {
        "type": "skip",
        "detail": "No affordable actions"
      }
    },
    {
      "type": "turn-end",
      "turn": 8
    },
    {
      "type": "action",
      "turn": 9,
      "action": {
        "type": "skip",
        "detail": "No affordable actions"
      }
    },
    {
      "type": "turn-end",
      "turn": 9
    },
    {
      "type": "action",
      "turn": 10,
      "action": {
        "type": "buy-event",
        "detail": "evt-charity-drive-27"
      }
    },
    {
      "type": "turn-end",
      "turn": 10
    },
    {
      "type": "action",
      "turn": 11,
      "action": {
        "type": "skip",
        "detail": "No affordable actions"
      }
    },
    {
      "type": "turn-end",
      "turn": 11
    },
    {
      "type": "action",
      "turn": 12,
      "action": {
        "type": "skip",
        "detail": "No affordable actions"
      }
    },
    {
      "type": "turn-end",
      "turn": 12
    },
    {
      "type": "action",
      "turn": 13,
      "action": {
        "type": "skip",
        "detail": "No affordable actions"
      }
    },
    {
      "type": "turn-end",
      "turn": 13
    },
    {
      "type": "action",
      "turn": 14,
      "action": {
        "type": "buy-event",
        "detail": "evt-festival-0"
      }
    },
    {
      "type": "turn-end",
      "turn": 14
    },
    {
      "type": "game-end",
      "turn": 14,
      "finalScore": 38,
      "result": {
        "outcome": "loss"
      },
      "endReason": "bankruptcy"
    }
  ],
  "results": {
    "finalScore": 38,
    "result": "loss",
    "endReason": "bankruptcy"
  }
}